{
  "name": "MaghrebSMP",
  "addresses": [
    "maghrebsmp.fun",
    "hax.ma"
  ],
  "categories": [
    "MINIGAMES",
    "PVP",
    "SURVIVAL"
  ],
  "notes": "Imported from LunarClient/ServerMappings (MIT, Copyright (c) 2023 Moonsworth, LLC).",
  "description": "Play SMP, Minigames, PvP, and more on MaghrebSMP.",
  "website": "https://maghrebsmp.fun/",
  "store": "https://store.maghrebsmp.fun",
  "socials": {
    "discord": "https://discord.gg/msmp"
  },
  "versions": [
    "1.8.*",
    "1.12.*",
    "1.16.*",
    "1.17.*",
    "1.18.*",
    "1.19.*",
    "1.20.*",
    "1.21.*"
  ],
  "primaryVersion": "1.21.11",
  "regions": [
    "EU"
  ],
  "gameTypes": [
    "Minigames",
    "PvP",
    "Survival"
  ],
  "colors": {
    "primary": "#50c878",
    "secondary": "#ffffff"
  },
  "iconUrl": "https://raw.githubusercontent.com/LunarClient/ServerMappings/master/servers/maghrebsmp/logo.png",
  "bannerUrl": "https://raw.githubusercontent.com/LunarClient/ServerMappings/master/servers/maghrebsmp/background.png"
}