{
  "name": "Asteria Network",
  "addresses": [
    "asterianw.com"
  ],
  "categories": [
    "BOXPVP",
    "PVP"
  ],
  "notes": "Imported from LunarClient/ServerMappings (MIT, Copyright (c) 2023 Moonsworth, LLC).",
  "description": "A Minecraft network featuring competitive BoxPvP gameplay",
  "website": "https://asterianw.com",
  "socials": {
    "discord": "https://discord.gg/asterianw"
  },
  "versions": [
    "1.21.*"
  ],
  "primaryVersion": "1.21.11",
  "regions": [
    "EU"
  ],
  "languages": [
    "tr"
  ],
  "gameTypes": [
    "BoxPvP",
    "PvP"
  ],
  "colors": {
    "primary": "#6A00FF",
    "secondary": "#00D4FF"
  },
  "iconUrl": "https://raw.githubusercontent.com/LunarClient/ServerMappings/master/servers/asterianetwork/logo.png"
}