{
  "name": "CROSS",
  "addresses": [
    "cross24.kr"
  ],
  "categories": [
    "PVP"
  ],
  "notes": "Imported from LunarClient/ServerMappings (MIT, Copyright (c) 2023 Moonsworth, LLC).",
  "description": "Minecraft PVP Server in Korea",
  "wiki": "https://cross-1.gitbook.io/cross24.kr/",
  "socials": {
    "discord": "https://discord.com/invite/cross24kr"
  },
  "versions": [
    "1.20.*"
  ],
  "primaryVersion": "1.20.1",
  "regions": [
    "AS"
  ],
  "gameTypes": [
    "PvP"
  ],
  "colors": {
    "primary": "#0e40e6",
    "secondary": "#208ad6"
  },
  "iconUrl": "https://raw.githubusercontent.com/LunarClient/ServerMappings/master/servers/cross/logo.png"
}