{
  "name": "GmMc",
  "addresses": [
    "gmmc.pl"
  ],
  "categories": [
    "PVP"
  ],
  "notes": "Imported from LunarClient/ServerMappings (MIT, Copyright (c) 2023 Moonsworth, LLC).",
  "description": "Enjoy with friends on GmMc!",
  "store": "https://www.gmmc.pl/",
  "socials": {
    "discord": "https://discord.gg/jEKMfQqvS4",
    "tiktok": "@gmmc_pl",
    "youtube": "GMMC_PL"
  },
  "versions": [
    "1.16.5",
    "1.17.1",
    "1.18.2",
    "1.19.4"
  ],
  "primaryVersion": "1.19.4",
  "regions": [
    "EU"
  ],
  "languages": [
    "pl"
  ],
  "gameTypes": [
    "PvP"
  ],
  "colors": {
    "primary": "#d7dde0",
    "secondary": "#f8c040"
  },
  "iconUrl": "https://raw.githubusercontent.com/LunarClient/ServerMappings/master/servers/gmmc/logo.png"
}