{
  "name": "Kodika Network",
  "addresses": [
    "kodika.live"
  ],
  "categories": [
    "SURVIVAL",
    "PVP",
    "MINIGAMES"
  ],
  "notes": "Imported from LunarClient/ServerMappings (MIT, Copyright (c) 2023 Moonsworth, LLC).",
  "description": "Premium gameplay guaranteed",
  "store": "https://tienda.kodika.live/",
  "socials": {
    "twitter": "KodikaNetwork",
    "discord": "https://discord.gg/ATCk2a3D3V",
    "tiktok": "@kodikanetwork"
  },
  "versions": [
    "1.16.*",
    "1.17.*",
    "1.18.*",
    "1.19.*",
    "1.20.*",
    "1.21.*"
  ],
  "primaryVersion": "1.20.4",
  "regions": [
    "NA"
  ],
  "gameTypes": [
    "Survival",
    "PvP",
    "Minigames"
  ],
  "colors": {
    "primary": "#04DAE4",
    "secondary": "#04A0E4"
  },
  "iconUrl": "https://raw.githubusercontent.com/LunarClient/ServerMappings/master/servers/kodikanetwork/logo.png"
}