{
  "name": "MCTeams",
  "addresses": [
    "mcteams.com"
  ],
  "categories": [
    "PVP"
  ],
  "notes": "Imported from LunarClient/ServerMappings (MIT, Copyright (c) 2023 Moonsworth, LLC).",
  "description": "The true experience of SoupPVP.",
  "website": "https://www.mcteams.com/",
  "store": "https://store.mcteams.com/",
  "socials": {
    "twitter": "MCTeams_",
    "discord": "https://discord.gg/KVpcCJhSXq",
    "telegram": "mcteamsnews"
  },
  "versions": [
    "1.7.*",
    "1.8.*"
  ],
  "primaryVersion": "1.8.9",
  "regions": [
    "NA"
  ],
  "languages": [
    "en"
  ],
  "gameTypes": [
    "PvP"
  ],
  "colors": {
    "primary": "#ffdf36",
    "secondary": "#ffffff"
  },
  "iconUrl": "https://raw.githubusercontent.com/LunarClient/ServerMappings/master/servers/mcteams/logo.png",
  "bannerUrl": "https://raw.githubusercontent.com/LunarClient/ServerMappings/master/servers/mcteams/background.png"
}