{
  "name": "Inferno",
  "addresses": [
    "inferno.uno",
    "inferno.wiki"
  ],
  "categories": [
    "PVP",
    "UHC"
  ],
  "notes": "Imported from LunarClient/ServerMappings (MIT, Copyright (c) 2023 Moonsworth, LLC).",
  "description": "Play PvP and UHC on Inferno.",
  "store": "https://inferno.uno/store",
  "socials": {
    "twitter": "infernowiki",
    "discord": "https://discord.com/invite/kUdGhmzCZR"
  },
  "versions": [
    "1.7.*",
    "1.8.*"
  ],
  "primaryVersion": "1.8.9",
  "regions": [
    "NA",
    "EU"
  ],
  "gameTypes": [
    "PvP",
    "UHC"
  ],
  "colors": {
    "primary": "#FEA82F",
    "secondary": "#FFD966"
  },
  "iconUrl": "https://raw.githubusercontent.com/LunarClient/ServerMappings/master/servers/infernouno/logo.png"
}