{
  "name": "BunkerkindSMP",
  "addresses": [
    "bunkerkindsmp.net"
  ],
  "categories": [
    "SURVIVAL",
    "BUILD"
  ],
  "icon": "icon.png",
  "banner": "banner.png",
  "disabledModules": [
    "noFog"
  ],
  "notes": "Imported from NoRiskClient/nrc-server-mappings (GPL-3.0).",
  "otherDisabledModules": [
    "NO_FOG"
  ],
  "socials": {
    "discord": "https://discord.gg/9v2BHGEn"
  },
  "gamemodes": {
    "survival": {
      "name": "Survival",
      "versions": [
        "ALL"
      ],
      "description": "Classic Survival with economy"
    }
  }
}