{
  "name": "EliteKits",
  "addresses": [
    "elitekits.net"
  ],
  "categories": [
    "PVP"
  ],
  "notes": "Imported from LunarClient/ServerMappings (MIT, Copyright (c) 2023 Moonsworth, LLC).",
  "description": "The revival of SoupPvP.",
  "website": "https://www.elitekits.net/",
  "store": "https://store.elitekits.net",
  "socials": {
    "twitter": "elitekitsnet",
    "discord": "https://discord.gg/YUh8J4HVr4"
  },
  "versions": [
    "1.8.*"
  ],
  "primaryVersion": "1.8.9",
  "regions": [
    "NA"
  ],
  "languages": [
    "en"
  ],
  "gameTypes": [
    "PvP"
  ],
  "colors": {
    "primary": "#005eff",
    "secondary": "#00aae3"
  },
  "iconUrl": "https://raw.githubusercontent.com/LunarClient/ServerMappings/master/servers/elitekits/logo.png",
  "bannerUrl": "https://raw.githubusercontent.com/LunarClient/ServerMappings/master/servers/elitekits/background.png"
}