{
  "name": "EcloriaMC",
  "addresses": [
    "ecloria.eu"
  ],
  "categories": [
    "PVP",
    "MINIGAMES"
  ],
  "notes": "Imported from LunarClient/ServerMappings (MIT, Copyright (c) 2023 Moonsworth, LLC).",
  "description": "Minigames Server 1.8+",
  "website": "https://ecloriamc.inovaperf.me/",
  "store": "https://ecloriamc.inovaperf.me/shop",
  "socials": {
    "discord": "https://discord.gg/qYHDuhRQZq"
  },
  "versions": [
    "1.8.*",
    "1.16.*",
    "1.17.*",
    "1.18.*",
    "1.19.*",
    "1.20.*"
  ],
  "primaryVersion": "1.8.9",
  "regions": [
    "EU"
  ],
  "languages": [
    "fr"
  ],
  "gameTypes": [
    "PvP",
    "Minigames"
  ],
  "colors": {
    "primary": "#ff8b00",
    "secondary": "#ffe300"
  },
  "iconUrl": "https://raw.githubusercontent.com/LunarClient/ServerMappings/master/servers/ecloriamc/logo.png"
}