{
  "name": "Irisium",
  "addresses": [
    "irisium.fr"
  ],
  "categories": [
    "SURVIVAL",
    "SKYBLOCK"
  ],
  "notes": "Imported from LunarClient/ServerMappings (MIT, Copyright (c) 2023 Moonsworth, LLC).",
  "description": "A survival, skyblock server made for the french-speaking community",
  "website": "https://irisium.fr/",
  "store": "https://irisium.fr/store",
  "socials": {
    "discord": "https://discord.gg/4EgP4DfAuW",
    "youtube": "@irisium.officiel",
    "twitch": "IrisiumOfficiel"
  },
  "versions": [
    "1.21.4",
    "1.21.5",
    "1.21.6",
    "1.21.7",
    "1.21.8",
    "1.21.9",
    "1.21.10"
  ],
  "primaryVersion": "1.21.4",
  "regions": [
    "EU"
  ],
  "languages": [
    "fr"
  ],
  "gameTypes": [
    "Survival",
    "Skyblock"
  ],
  "colors": {
    "primary": "#9146ff",
    "secondary": "#481485"
  },
  "compliance": {
    "rules": "https://irisium.fr/rules"
  },
  "iconUrl": "https://raw.githubusercontent.com/LunarClient/ServerMappings/master/servers/irisium/logo.png",
  "bannerUrl": "https://raw.githubusercontent.com/LunarClient/ServerMappings/master/servers/irisium/background.png"
}