{
  "name": "LOLImpo",
  "addresses": [
    "lolimpo.net"
  ],
  "categories": [
    "SURVIVAL"
  ],
  "icon": "icon.png",
  "notes": "Imported from LunarClient/ServerMappings (MIT, Copyright (c) 2023 Moonsworth, LLC).",
  "description": "Italian Survival Server",
  "website": "https://lolimpo.net/",
  "socials": {
    "discord": "https://discord.gg/lolimpo",
    "instagram": "lolimpo.net",
    "telegram": "LOLImpoLFG"
  },
  "versions": [
    "1.20.*"
  ],
  "primaryVersion": "1.20.1",
  "regions": [
    "EU"
  ],
  "gameTypes": [
    "Survival"
  ],
  "colors": {
    "primary": "#FCA800",
    "secondary": "#00A0FA"
  },
  "bannerUrl": "https://raw.githubusercontent.com/LunarClient/ServerMappings/master/servers/lolimpo/background.png"
}